Location,Name,Review,Time,Rating
ChIJO87U12kUrjsRNiANLOxsCdo,Esha Jain,This place is really amazing and unique. The thrill and  enjoyment that we experience in the Breakout escape rooms cannot be experienced elsewhere. It's really different from all the other places that I've visited or the fun games that I've played. The staff is also very supportive and helpful. The staff members like mahek interact really well. Enjoyed alot :),2 months ago, 5 stars 
ChIJO87U12kUrjsRNiANLOxsCdo,dhinesh rajasekaran,"Must visit place in Bangalore!!

Location: Easily accessible through cab or any favourable mode of commute
Experience: A unique experience u can explore with your friends , has various levels and different story lines..
Deciphering and unlocking clues gives you chills and fun",10 months ago, 5 stars 
ChIJO87U12kUrjsRNiANLOxsCdo,Subhadeep Barkataki,"It was an exciting experience altogether! The murder mystery was challenging yet fun. Definitely recommend this place if you like solving mysteries. 
Your investigative skills would come handy here!

The crew was very friendly and helpful.",4 months ago, 5 stars 
ChIJO87U12kUrjsRNiANLOxsCdo,Prashanth Chanaboina,"We played Curse of the pharaoh game with my colleagues, it was fun playing a role of archaeologist for one hour. This was challenging in the most amazing and entertaining way. Lot of fun solving puzzles, read the ancient Egyptian rituals which is more interesting and etc etc....  Really impressed with effort they put designing different sets looks like Egypt. We felt like we are in Egypt for one hour. The staff was very friendly. Overall we had a great experience and I would highly recommend this to anyone looking for a new and unusual experience inside the city. We’ll comeback again 😁😁😁 Highly recommended!",5 months ago, 5 stars 
ChIJO87U12kUrjsRNiANLOxsCdo,Meenakshi Parameswaran,Good place to have fun with a group of 5 -6 people. Interesting and mindful game. Must visit if you like to solve puzzles,2 months ago, 4 stars 
ChIJO87U12kUrjsRNiANLOxsCdo,LaFilleChic,"Me and three of my girlfriends went to BREAKOUT ESCAPE ROOMS one sunday evening hoping for a new experience because mostly Bangalore is all about dining out and partying (as you know there is no shortage of those in the city). And a new adventure is exactly what we got. 

In case you don't know what you do in an Escape room, basically you and your team are locked inside a ROOM for a set time. In that time you are assigned a task to complete and then break out of the room. In our case, the task was to save a little girl who got kidnapped, find the culprits and then find the code to get out of the space in 60 mins before the virtual BOMB goes off and we all virtually die.

I wish I could write all that we had to do inside to achieve that, but alas, I don't want to give any spoilers and ruin your fun! All I would say though is that we found the girl and identified the culprits but unfortunately couldn't get out of the room in time. Nevertheless, all four of us had an amazing time playing detectives half the time and being goofy the other half. I think this is a great bonding and team building activity because you got to coordinate with your teammates. This was our first time ever in an escape room so the experience was even more memorable and unique for us. 

So if you want to do something fun this weekend, I would definitely recommend BREAKOUT ESCAPE ROOM to you!",2 months ago, 5 stars 
ChIJO87U12kUrjsRNiANLOxsCdo,smita J,"We just walked in without any expectations... And we’re totally bowled over by the whole experience. Great idea, amazing people and a first hand experience of actually being inside a game.
It’s a must visit place for all age groups .",2 months ago, 5 stars 
ChIJO87U12kUrjsRNiANLOxsCdo,prakash jain,An amazing thriller experience we had in breakout and also were greeted properly though there was a crowd. I was amazed that they managed pretty well in such a small space and arranged different adventurous and thriller mysteries for people who come with curiosity to find something new and experience a great time. We would like to immensely thank our host and game master Saptadeep and extremely talented client professional Mahek made us feel comfortable with his service with his positive attitude.,2 months ago, 5 stars 
ChIJO87U12kUrjsRNiANLOxsCdo,MUKUND KUMAR,"Great stressbuster! 
It's great when we play a character in real life for an hour.
Things got interesting and more interesting as we went into the games. Clue after clue and then Breaking out.  Playing at live scale of 1:1 was a great experience. Time limit makes it more interesting . Going through reports and interpreting clues and so much. I loved it!",6 months ago, 5 stars 
ChIJO87U12kUrjsRNiANLOxsCdo,VinothKumar Subramanian,It was really excellent the ways things are arranged and executed. Kudos to the entire team. Special thanks to Mahek Jain who has coordinated and guided us in the right track.,2 months ago, 5 stars 
ChIJO87U12kUrjsRNiANLOxsCdo,Aadit Shah,This was a very difficult and fun challenge for newcomers. We learned a lot about escape rooms and how to solve the puzzles inside them. Would definitely recommend it.,2 months ago, 5 stars 
ChIJO87U12kUrjsRNiANLOxsCdo,Sujith M,This was my first time escape room experience and it was really thrilling and fun..the staff are really supportive and guide you nicely...prices are a bit expensive but overall great first time experience. Interested to try all of their rooms. Keep up the good work guys.,4 months ago, 5 stars 
ChIJO87U12kUrjsRNiANLOxsCdo,Tanuja Pattnaik,We had an amazing time here on our trip to Bangalore. It was so good that we visited once again the next day. Loved the experience. Superb!,3 months ago, 5 stars 
ChIJO87U12kUrjsRNiANLOxsCdo,Anusha Maniar,"It was Amazing!!! This was the second time I went. The storylines are amazing and unlike other escape rooms where once you crack the code is done, here you have a whole fun follow up quiz sorta thing. Definitely a perfect place for a fun time 😍",9 months ago, 5 stars 
ChIJO87U12kUrjsRNiANLOxsCdo,javvaji sripriya,Nice place. You get to challenge your brains.  It's a good brain exercise And you have a lot of fun. It's a really good place to visit with your friends. Customized parties are also available.,4 months ago, 5 stars 
ChIJO87U12kUrjsRNiANLOxsCdo,Jharna Kukreja,"Had a great day at Breakout Escape Rooms with my kids. They played the Enchanted forest game. In their game they had to hunt for treasures in a forest in order to save the famine hit people of a fictional Kingdom. It was a surreal and unique experience for the both of them.

I had the chance to participate in a game called ‘Curse of the Pharaoh’ where we pretended to be a group of archeologists that had to hunt for artifacts in Egypt, discover a secret tomb, restore the reputation of a famous archaeologist and uncurse the Pharaoh before the place is destroyed. It was an adventure and I had a serious adrenaline rush and thrill trying to solve the mystery.

This centre offers a wide variety of Escape Room experiences like solving a murder mystery, rescuing a young kidnapped child, conducting a bank robbery, trying to breakout after being trapped while investigating a story and some others.",3 months ago, 5 stars 
ChIJO87U12kUrjsRNiANLOxsCdo,Mohammed Salman,Lovely escape room with helpful and friendly staff! Would highly recommend this.,9 months ago, 5 stars 
ChIJO87U12kUrjsRNiANLOxsCdo,Sachit Zzz,"This is the best ever escape room I've visited, mind boggling clues, the game curse of Pharaoh is truly a test to the grey matter.a perfect ambiances of Egypt, we felt like it was all real. Worth the money many times more. We were told it was in a test run, to us it was beyond perfect.",5 months ago, 5 stars 
ChIJO87U12kUrjsRNiANLOxsCdo,viona dalmeida,My first escape room and I m coming back for more. The best part about this escape room is there is a background story which makes it more intriguing as well as the room setup for us to connect to the background story. The hosts were also good. Overall loved the experience.,5 months ago, 5 stars 
ChIJO87U12kUrjsRNiANLOxsCdo,ajay arbale,"Great experience. An hour well spent.
Also, management is very helpful and will make sure you are having a good time.",3 months ago, 5 stars 
ChIJO87U12kUrjsRNiANLOxsCdo,Aravind B H,Very unique way to engage in team building. The puzzles required a lot of interaction and we had a.nice time.,2 months ago, 4 stars 
ChIJO87U12kUrjsRNiANLOxsCdo,Rahul Kumar,"Very unhygienic place filled with dust, stinky dungeon. Quite expensive for the experience. I could have got locked in an old unclean room for free, absolutely waste of weekends! They have kept some fancy props for attracting young people but it isn’t worth the money or time.

NEVER RECOMMENDED!",a month ago, 1 star 
ChIJO87U12kUrjsRNiANLOxsCdo,Parul Jain,"Breakout gave me one of the best ever escape room experience as it has many thrilling and exciting escape room concepts, and the staff is so co-operative and customer-friendly especially there are faculty named Mahek Jain and Saptadeep Ghosh, both of them made me experience a real life based scenario by their story telling skills",2 months ago, 5 stars 
ChIJO87U12kUrjsRNiANLOxsCdo,Bhavik Chugani,The storyline is very enthralling. The setup really compliments the storyline and the complexity of the escape rooms are brilliant,2 months ago, 5 stars 
ChIJO87U12kUrjsRNiANLOxsCdo,SAPTADEEP GHOSH,"Me and my friend played Kidnapped breakout and it was the first time for us and we had an amazing experience we enjoyed our hearts out!
And hats off to the amazing staff who helped us whenever required.
I would recommend everyone who comes to bangalore or who stays in Bangalore to atleast come here once and experience the thrill!",3 months ago, 5 stars 
ChIJO87U12kUrjsRNiANLOxsCdo,Mahesh Bhat,"Amazing experience. We were a group of 7 people and tried ""Trapped"". The theme, clues, the guides are all too good.
One suggestion: Light was too dim inside. You can provide one or two torchlights.",5 months ago, 5 stars 
ChIJO87U12kUrjsRNiANLOxsCdo,Mansie Chaudhary,Didn't like the place at all. The built up to the given task was nice but the escape room itself was disappointing. There was no clarity on how to go about solving it and a big mismatch on the overall theme. Wouldn't recommend.,3 months ago, 1 star 
ChIJO87U12kUrjsRNiANLOxsCdo,Ishaan Rao,We had fun even though we were trash at figuring out the clues. Definitely recommend it to all age groups!,9 months ago, 5 stars 
ChIJO87U12kUrjsRNiANLOxsCdo,Venu Akshay,It was difficult to find out clues....but still that's the game and we enjoyed the story line!!,9 months ago, 5 stars 
ChIJO87U12kUrjsRNiANLOxsCdo,Benwin Thattil,"A very much challenging, adventurous and fun-filled experience. I visited this place along with my group of friends, it was our first time at a place like this.
All we wanted was an experience, and they have done it very well. We took the ""Kidnapped Mystery"" which indeed has a lot of distractions as well as tricky puzzles.
Its actually puzzles built in a chain where you have to start at one end and solve your way through to get to the mystery and escape the room, do not forget to take note if the story clues that they have hidden all over the place.
However it is a one time experience, i might suggest it to people who have never been to such kind of place, or if you enjoy solving a lot of puzzles, you may visit this place with all its themes, as well as many similar breakout rooms in the city.
Its a good place for teambuilding, recreation and spending some money on some spooky experience.
I saw a review for this place stating that they booked this place for a birthday party, well that person should understand the nature of this place, its not a party hall or sort, just a game room kind of place.",a year ago, 5 stars 
ChIJO87U12kUrjsRNiANLOxsCdo,Punyasloka Padhy,Never expected this much fun in the cabin. Quite different experience in all together. Don't know about the cost.,4 months ago, 5 stars 
ChIJO87U12kUrjsRNiANLOxsCdo,Vikas Diwakar,"Had a really enjoyable experience celebrating our kids birthday here. The game and story experience is very good with engaging and quite detailed plots and an authentic ambience. 1 hour passes very quickly when you are trying to find clues and solve puzzles. Some scary and creepy moments for the kids but that was also fun.
I felt it was a bit on the expensive side at Rs 500 per person. For that price I expected really engrossing A/V effects and a much better ambience matching the game play. For what is available a fairer price would be about Rs 300-350. The spaces are a bit small. Staff is very courteous and helpful. 
Overall we had great fun and this is highly recommended for people looking for a different and unique experience.",2 years ago, 4 stars 
ChIJO87U12kUrjsRNiANLOxsCdo,shaik fayaz,I visited this amazing place today...breakout mystery room...different themes were there... we selected kidnap case theme... it was amazing...the clues and the setup was awesome and staff was really good...the way they treat with us is good...best mysterious room in Bangalore,5 months ago, 5 stars 
ChIJO87U12kUrjsRNiANLOxsCdo,anjali chopra,"This was my first Escape roomr and I am coming back for more . It was an exciting experience and we enjoyed a lot so many games . It was challenging yet fun . The hosts were so good . Overall loved the experience . We had too much fun at breakout escape . Breakout escape full team is so dedicated to their work . They knows how to treat everyone thanks to full team you guys are doing so well ..The best part which I like that kids are having their own time with games and parents can enjoy their own time in games .
Do go and check out this wonderful games house in kormangala with your friends for fun and adventureous experience .",3 months ago, 5 stars 
ChIJO87U12kUrjsRNiANLOxsCdo,Sadiya Yusuf,"We had a blast at Breakout.escape kormangala. It was a stress buster for us and we had a gala time . Loved the ambience and I am thankful for the team for serving us very kindly. Thank you for your love and support. Even my lil ones had fun they have enchanted forest mystery room for the kids too. Must visit place in bangalore when you are bored of everything in life. One of the best place for team outing, bdays and siblings Day out.",3 months ago, 5 stars 
ChIJO87U12kUrjsRNiANLOxsCdo,Rahil Ahmed S,"Best Escape Room Experience in Bangalore.
highly recommended for corporate getaways and Birthday Party celebrations in Koramangala & Indiranagar Bangalore.",3 months ago, 5 stars 
ChIJO87U12kUrjsRNiANLOxsCdo,Venugopal Hegade,"Regardless of what others say we really loved it, it was fun and interesting as a group we were solving the puzzles and took us back to the good old days as kids and the hosts were really kind and kept us busy throughout. Yes there was only one restroom and wouldn't be comfortable to use the same as its not secluded and had to pass through lot of people in the room apart from that a good time killer and great team building activities",5 months ago, 5 stars 
ChIJO87U12kUrjsRNiANLOxsCdo,Divahar J,"One of a kind experience. Good work for your brain. Though you might feel that it's easy, there are pretty tough ones. Best for a team of lesser people as it makes it more challenging.",8 months ago, 5 stars 
ChIJO87U12kUrjsRNiANLOxsCdo,Kriti Nathani,It was an exciting experience...and we enjoyed a lot solving murder mystery...it was challenging yet fun.... definitely recommend this place..,4 months ago, 4 stars 
ChIJO87U12kUrjsRNiANLOxsCdo,Rohit Das,"I went there for corporate event last week and I found this place is Pathetic, worst I have never seen such a low quality escape room in my life. Place is unhygienic and food was worst quality looks like some road side stall food they are serving. Food was soo unhygienic, low quality and I will never recommend this place for the kids and adults. I got shocked when I knew that they don’t have washroom On the floor, they have sent upstairs in some office and the washroom was too dirty and only one washroom was there. Please don’t waste your time here. This place is not worthy to visit. Game was ok staff was good and helpful but the location and quality of escape room is worst.  Better to try other escape room. Don’t waste your time here",5 months ago, 1 star 
ChIJO87U12kUrjsRNiANLOxsCdo,Ankit Bhandari,This place is awesome to visit.our experience is 5 star. This is a must visited escape room in Bangalore..,2 months ago, 5 stars 
ChIJO87U12kUrjsRNiANLOxsCdo,NS niranjan,"We, team of 5 went for the first time...and we all never tried any escape rooms ,this was the one we tried first and we opted the most toughest game and the percent of clearing the game was only 2% but we all successfully cleared it. That was a great experience, must visit and can enjoy to the best. Give a try and everyone will enjoy it.",8 months ago, 5 stars 
ChIJO87U12kUrjsRNiANLOxsCdo,Hamza Qazi,A really fun and interesting experience with friends. 10/10 would visit again.,10 months ago, 5 stars 
ChIJO87U12kUrjsRNiANLOxsCdo,Anoop Garg,"Not worth the money. Very small rooms, only good for 3-4 people. The activity itself is not very logical or engaging. No puzzles to find any clue, just use the objects around you. Will not recommend anyone to go and waste money.",5 months ago, 1 star 
ChIJO87U12kUrjsRNiANLOxsCdo,Navaneeth Krishnan Karimbil,"This was my first experience with solving a mystery to escape from a room. We played the murder mystery here. The storyline was really good. We really enjoyed solving the case. It was a really good experience and nice exercise to build team bonding. The staffs here are very friendly and cordial. They dont just let you paly, finish the game and let go. They explain you the game well, spend time with us listening to what we have found and what better they can do. Really looking forward to try out other rooms here.",11 months ago, 5 stars 
ChIJO87U12kUrjsRNiANLOxsCdo,swati mohanty,"A GREAT CRIME GAME and one that you really DON'T WANNA MISS !
The game which we played was murder mystery. We were given a limited time to solve the case which made the game look more intense and real. We did all kinds of things that actually felt like detective work. Especially the narrator of the story Nikita sounded like a breath of fresh air to the classic that I found myself feeling like a real Sherlock, trying to peice together the little details to get a bigger picture and eventually solve the case with my teammates.",6 months ago, 5 stars 
ChIJO87U12kUrjsRNiANLOxsCdo,varun gururaj,"I have been to this place , the staff were very pleasing as they assisted us with the game , Me and my team played classified game it was worth the experience . Cheers !",5 months ago, 5 stars 
ChIJO87U12kUrjsRNiANLOxsCdo,Batman,Very nice experience. But a bit costly. Should provide some discounts to groups.,4 months ago, 4 stars 
ChIJ74XAbuL8DDkR-wJQ-vQyHkQ,Mrinmoy Chakraborty,"Want to experience the heart of Indian national and political activities - go to Red Fort. It's a living history. Just love here to be multiple times ❤️. I suggest you to go there in late afternoon, you get awesome lighting of the buildings inside the fort. There is a small handicrafts market, you will get a lot of interesting thi gs to buy but you should have a thick purse as well. If you would like to know about the history of it, go there, get a guide (audio guide also available) and indulge yourself.",3 weeks ago, 4 stars 
ChIJ74XAbuL8DDkR-wJQ-vQyHkQ,susmita moi,"great place to hangout with family , pace is also very clean..
loved the place.It's a beautiful place to reminisce your
history. The coolness of the air at the top
of the fort is incomparable. One should
visit the place with your adored one to
have the total fun. You have lush green
lawns and so many spots to have a seat
and talk.Each wall really has a story to tell.
Hence ,one must really take a professional
guide to be informed accordingly. To enter
inside red fort you need to get the tickets
and if you will pay offline it will cost u
around 50 rupees for just visiting and
around 80 rupees for museum. Buy online
you need to pay only 35 rupees and 56
rupees for museum so you can book
online it will be easy for you.",2 months ago, 5 stars 
ChIJ74XAbuL8DDkR-wJQ-vQyHkQ,SATENDER SINGH,"It was a great experience. 
This place is BEAUTIFUL and they really do maintain it amazingly! This landmark comprises a large complex full of multiple architectural structures with acres of well-kept gardens in between. It is all enclosed by a huge red wall, giving it its name. 

I didn't visit the museum but spent 90 minutes walking around the grounds and still felt I could take longer. It felt safe and the facilities are clean. Absolutely worth a visit!",2 months ago, 4 stars 
ChIJ74XAbuL8DDkR-wJQ-vQyHkQ,Neeraj kumar Singh,"One of the greatest monuments of India and the walk around the place is so peaceful. A must visit for relaxation and learning more about the history of Indian revolution of getting freedom. There are also museums within to learn more about each initiative and weapons used during that time. Great place to be opted for children to understand our history and explore this monument. Also, they host lot of shops within the premises. During Indian Independence day the Indian flag is hoisted here.",2 months ago, 5 stars 
ChIJ74XAbuL8DDkR-wJQ-vQyHkQ,Vaishali Tokas,Located in the most crowded place of the capital it is most dirtiest heritage site. Not at all maintained by the board. Though it has large garden where you can sit and spend sometime. The crowd isn't that good either. Best of the place is mini market inside it. The shops inside RED FORT are a think to speak for. They have a wide variety of antique pieces. From necklace to clothes. From glasses to other ancient things you can easily find all those their at reasonable prices. Plus if you are a non veg lover you should must visit them place. It offers superb options in non veg food.,2 weeks ago, 3 stars 
ChIJ74XAbuL8DDkR-wJQ-vQyHkQ,Jaikishan Saini,"loved the place.It's a beautiful place to reminisce your
history. The coolness of the air at the top
of the fort is incomparable. One should
visit the place with your adored one to
have the total fun. You have lush green
lawns and so many spots to have a seat
and talk.Each wall really has a story to tell.
Hence ,one must really take a professional
guide to be informed accordingly. To enter
inside red fort you need to get the tickets
and if you will pay offline it will cost u
around 50 rupees for just visiting and
around 80 rupees for museum. Buy online
you need to pay only 35 rupees and 56
rupees for museum so you can book
online it will be easy for you. Happy Visit!
 10  Share",2 months ago, 5 stars 
ChIJ74XAbuL8DDkR-wJQ-vQyHkQ,Sourav Bhadra,"We went to the Red Fort as part of our Delhi City and highlights tour. It is a UNESCO World Heritage site and is an impressive building. It is a very large walled Fort - 2.5km around the battlements.
Others on the site have commented that foreign tourists pay much more than locals for entrance but that is quite normal in India and be prepared for men and women to enter separately and to be searched.
The monument is occupied mainly by the military and the armed guards are very obvious and initially made me look twice. There are also numerous protective metal 'shields' in very visible locations. We were told that this is all due to the situation with Pakistan - we had not expected it and made us feel a bit on edge.
Once inside the gates there is an arcade that is full of 'merchants' - this is not a good place to buy!! There are numerous other celebratory buildings within the walls.
This is a large 'site' and you need to be realistic in the amount of time you want to spend here. Our guide suggested no more than two hours and it is easy to go into overload here.",a month ago, 5 stars 
ChIJ74XAbuL8DDkR-wJQ-vQyHkQ,Prit Patel,"This place is BEAUTIFUL and they really do maintain it amazingly!  This landmark consists of a large complex full of multiple architectural structures with acres of well-kept gardens.  It is all enclosed by a huge red wall, giving it its name.  You must visit this place for SURE.  It 's very well maintained and very beautiful from inside to0, not just outside.  Do visit the museums inside (it's an extra ticket for that), which are well detailed and maintained.  Walk all the way inside for the nice architecture.  General Chat Chat Lounge  General Chat Chat Lounge  You can click a lot of good pics too.  There is a market inside, but I felt the prices were higher than that outside, so not better buy or bargain well.  You 'll at least need an hour to go through everything in there.",2 months ago, 5 stars 
ChIJ74XAbuL8DDkR-wJQ-vQyHkQ,Himanshu Singh,"This place is BEAUTIFUL and they really do maintain it amazingly! This landmark comprises a large complex full of multiple architectural structures with acres of well-kept gardens in between. It is all enclosed by a huge red wall, giving it its name. 

I didn't visit the museum but spent 90 minutes walking around the grounds and still felt I could take longer. It felt safe and the facilities are clean. Absolutely worth a visit!",3 months ago, 5 stars 
ChIJ74XAbuL8DDkR-wJQ-vQyHkQ,Joanna Duncan,"This place is BEAUTIFUL and they really do maintain it amazingly! This landmark comprises a large complex full of multiple architectural structures with acres of well-kept gardens in between. It is all enclosed by a huge red wall, giving it its name. 

I didn't visit the museum but spent 90 minutes walking around the grounds and still felt I could take longer. It felt safe and the facilities are clean. Absolutely worth a visit!",3 months ago, 5 stars 
