Location,Name,Review,Time,Rating
ChIJ74XAbuL8DDkR-wJQ-vQyHkQ,Sachin Kumar,"India gate was constructed to honor the soldiers of India that were killed during world war 1. This structure boasts of a beautiful architecture by India. It was first inaugurated in the year 1931 and it still has the same charm. Also, this structure reminds of us the sacrifices made by thousands of soldiers who have given their lives during the first world war. The essay on India gate is an insight into this famous memorial in India. 
Whenever someone visits Delhi, they never miss the India gate. Thus, it has become one of the integral parts of Delhi and also a major tourist attraction. The locals as well as the tourists coming to visit Delhi flock this place all around the year. Also, for many locals, the sprawling lawns around the gate on both sides is a nice picnic spot. 

It is very easy to reach the India gate as it is located centrally. Also, for winters, people pack their lunch and head to India gate along with their friends and families to spend the quality time. One can see children playing in these lawns along with elders sitting. The sight also looks good during the summer months. However, the most beautiful time to visit this place is in the night when it is illuminated fully with lights.",2 months ago, 5 stars 
ChIJ74XAbuL8DDkR-wJQ-vQyHkQ,B Ganesh P,Beautiful place to visit if you're on short vacation in delhi you must visit it. When I visited it 1st time I was utterly shocked by watching all the interior design made by architect people. You will see the museums inside the red fort I seen one only but there are few. Best wishes,a week ago, 5 stars 
ChIJ74XAbuL8DDkR-wJQ-vQyHkQ,Jaimin Sutariya,"Very beautiful place for tourist ,
Beautiful place to visit. Structures are pleasure to the eyes, one can do shopping inside the fort and buy pretty souvenirs at affordable price. And interested ones can also check out the museums inside, for which you'll have to make additional payments. One good thing which caught my attention was the cleanliness of the washrooms inside. Kudos to that",2 months ago, 4 stars 
ChIJ74XAbuL8DDkR-wJQ-vQyHkQ,Dude Perfect Thrill,"loved the place.It's a beautiful place to reminisce your
history. The coolness of the air at the top
of the fort is incomparable. One should
visit the place with your adored one to
have the total fun. You have lush green
lawns and so many spots to have a seat
and talk.Each wall really has a story to tell.
Hence ,one must really take a professional
guide to be informed accordingly. To enter
inside red fort you need to get the tickets
and if you will pay offline it will cost u
around 50 rupees for just visiting and
around 80 rupees for museum. Buy online
you need to pay only 35 rupees and 56
rupees for museum so you can book
online it will be easy for you. Happy Visit!",3 months ago, 4 stars 
ChIJ74XAbuL8DDkR-wJQ-vQyHkQ,Rajneesh Kumar,Red fort is a great place to visit with your family and friends. It's more beautiful when you visit it during night hours because when they switch on  those lights which focuses on the structure then it looks awesome. If you're are visiting during morning or afternoon then you can go inside by paying 30₹ as entry fee and can see many more historical things and also you can do a little bit of shopping inside if you like to buy antique jewellery and many other things,2 months ago, 4 stars 
ChIJ74XAbuL8DDkR-wJQ-vQyHkQ,Garveeta Singh,"Had I know the fort houses so many memories, I would have stepped here long before!! Nevertheless, visit to make great memories, retreat your eyes and heart and obviously to enjoy the perks of being in Delhi! If you find a white dog your way, then it's a brownie point as the dog belong to Red Fort and it helps the tourist enjoy their time. It would also leave you outside safely and would return back! Dog lovers, a love alert your way ❤ Non dog lovers, well you have walls, museums, the palaces you enjoy 😇",2 months ago, 5 stars 
ChIJ74XAbuL8DDkR-wJQ-vQyHkQ,Aplha G,"Beautiful place to visit. Structures are pleasure to the eyes, one can do shopping inside the fort and buy pretty souvenirs at affordable price. And interested ones can also check out the museums inside, for which you'll have to make additional payments. One good thing which caught my attention was the cleanliness of the washrooms inside. Kudos to that 👍👍👍",2 months ago, 5 stars 
ChIJ74XAbuL8DDkR-wJQ-vQyHkQ,Siddharth Chourasia,"You must visit this place for SURE. It's very well maintained and very beautiful from inside too, not just outside. Do visit the museums inside (it has an extra ticket for that), that are well detailed and maintained. Walk all the way inside for the nice architecture... You can click a lot of good pics too. There is a market inside, but I felt the prices were higher than that of outside, so better not buy or bargain well. You'll at least need an hour to go through everything in there.",3 months ago, 4 stars 
ChIJ74XAbuL8DDkR-wJQ-vQyHkQ,SUPARNA SAMANTA,History doesn't mean to learn the facts but to give us an insight to the events that took place in the past. They are standing pillars and observers of the past. Do visit red fort and know a little bit of the great mughal empire which ruled India and made many architectural marvels on the land of our motherland - INDIA🇮🇳🇮🇳,2 weeks ago, 5 stars 
ChIJ74XAbuL8DDkR-wJQ-vQyHkQ,SPREET,"Red Fort is very famous and nice place to visit..
Inside the Red Fort some weapons and parks are available.. The fort's architectural build is magnificent and beautiful.. This place is well managed and in quite good condition... 
I'll definitely recommend to visit this place at least once in lifetime...",2 months ago, 5 stars 
ChIJ74XAbuL8DDkR-wJQ-vQyHkQ,IRSHAD BHATI,"This place is BEAUTIFUL and they really do maintain it amazingly! This landmark comprises a large complex full of multiple architectural structures with acres of well-kept gardens between. It is all enclosed by a huge red wall, giving it its name.  
.
 You must visit this place for SURE. It's very well maintained and very beautiful from inside too, not just outside. Do visit the museums inside (it has an extra ticket for that), that are well detailed and maintained. Walk all the way inside for the nice architecture... You can click a lot of good pics too. There is a market inside, but I felt the prices were higher than that of outside, so better not buy or bargain well. You'll at least need an hour to go through everything in there.",3 months ago, 5 stars 
ChIJ74XAbuL8DDkR-wJQ-vQyHkQ,Paras Saini,"The red fort is an impressively sized building with some fantastic architecture. There is technically not much to do there, but the main draw is the fantastic building itself, the columns and the design really are beautiful. The manicured gardens and grounds are also a really pleasant way to spend an afternoon, a little oasis away from the hustle of Delhi. It may be worth bringing a small picnic and relaxing here for a few hours as many families seem to do. It is well worth a visit if you are in Old Delhi.",3 months ago, 5 stars 
ChIJ74XAbuL8DDkR-wJQ-vQyHkQ,harmeet kaur,"If you want to explore every nook and cranny of this place then you must have at least 5-6 hours. The place is awesome for those who admire ancient architecture and monuments. Inside there are a no of museums solely dedicated to history of Indian independence. There is also a small bazaar to take souvenirs with you ( jewellery, handicrafts etc). You cannot take anything edible with you inside the premises and also there is no canteen sort of thing inside the fort, so eat nicely before visiting the fort otherwise you will be famished inside the fort as you have to walk a lot explore.",3 months ago, 4 stars 
ChIJ74XAbuL8DDkR-wJQ-vQyHkQ,Aditya R,"Loved this place... Very huge and attractive you will get to know your history. Have an Park also. There is an e-rikshaw facility to help you travel the premises of red fort. Eating facility is also available at the main entrance. Great place to go with the family outing😍❤️.
The walls and architecture is really awesome ❤️",2 months ago, 5 stars 
ChIJ74XAbuL8DDkR-wJQ-vQyHkQ,Arvind_Khawa,"loved the place.It's a beautiful place to reminisce your
history. The coolness of the air at the top
of the fort is incomparable. One should
visit the place with your adored one to
have the total fun. You have lush green
lawns and so many spots to have a seat
and talk.Each wall really has a story to tell.
Hence ,one must really take a professional
guide to be informed accordingly. To enter
inside red fort you need to get the tickets
and if you will pay offline it will cost u
around 50 rupees for just visiting and
around 80 rupees for museum. Buy online
you need to pay only 35 rupees and 56
rupees for museum so you can book
online it will be easy for you. Happy Visit!",4 months ago, 5 stars 
ChIJ74XAbuL8DDkR-wJQ-vQyHkQ,Sahil Garg,"You must visit this place for SURE. It's very well maintained and very beautiful from inside too, not just outside. Do visit the museums inside (it has an extra ticket for that), that are well detailed and maintained. Walk all the way inside for the nice architecture... You can click a lot of good pics too. There is a market inside, but I felt the prices were higher than that of outside, so better not buy or bargain well. You'll at least need an hour to go through everything in there.",3 months ago, 5 stars 
ChIJ74XAbuL8DDkR-wJQ-vQyHkQ,Ramya Vamsi,"INDIA. S PRIDE. THE HILARIOUS.. HISTORICAL. ""THE RED FORT""... 
NO WORDS ABOUT TO SAY. THIS... 
MILLIONS PEOPLE NOT ABOUTS TO SAY THIS PLACE BECAUSE THIS IS AWESOME... 
HIGHER IS HIGHER.. MONUMENTS IN DELHI. THERE ARE IN ONE OF THEM 

.",2 months ago, 5 stars 
ChIJ74XAbuL8DDkR-wJQ-vQyHkQ,Heartography Heart meets Photography,"Nothing like how I imagined it to be! Had been seeing this place on TV since childhood, but nothing came close to what the reality was, especially once you entered into the Red Fort the gift, souvenir shops and everything were quite surprising had never expected them. 
The garden and the museum is very well maintained. 
Everything is very clean and the security is very good. 
Overall, recommend this place, should be in one's itenary if you are in Delhi.",2 months ago, 4 stars 
ChIJ74XAbuL8DDkR-wJQ-vQyHkQ,Aakash Ratkal,"It is one of the most important monument of India. Has been a part of our patriotism right from the day India became independent. The prime minister of India delivers a speech every year on the Independence day.
This monument can also be found on our currency notes as well",2 months ago, 5 stars 
ChIJ74XAbuL8DDkR-wJQ-vQyHkQ,Vinay Kalani,"It's a beautiful place to reminisce your history. The coolness of the air at the top of the fort is incomparable. One should visit the place with your adored one to have the total fun. You have lush green lawns and so many spots to have a seat and talk.Each wall really has a story to tell. Hence ,one must really take a professional guide to be informed accordingly.To enter inside red fort you need to get the tickets and if you will pay offline it will cost u around 50 rupees for just visiting and around 80 rupees for museum. But online you need to pay only 35 rupees and 56 rupees for museum so you can book online it will be easy for you.  Happy Visit!",5 months ago, 5 stars 
ChIJ74XAbuL8DDkR-wJQ-vQyHkQ,sagar chavan,Nice place to spend time. I suggest you hire a guide or take audio guide from the entrance. It will be much helpful.,a week ago, 5 stars 
ChIJ74XAbuL8DDkR-wJQ-vQyHkQ,Harsh narayan Shukla,"A section of this fort is where the emperor spent the last 8 years of his life under house arrest by his son who dethroned him. What a respectful son. Very interesting story, and a beautiful.
We visiting the fort on a nice day. Walked down to the entrance and back. Very majestic looking fort. Nice architecture.

The Red Fort is a large complex located near the old town in Delhi. Overall the architecture is interesting and the fort is historically significant, however irritatingly there is an excessively long.",3 months ago, 5 stars 
ChIJ74XAbuL8DDkR-wJQ-vQyHkQ,Vanita m,"What should I say about this place.. It is one of the greatest monuments of India.. Its so peaceful, great to have a hangout during evening.",2 weeks ago, 5 stars 
ChIJ74XAbuL8DDkR-wJQ-vQyHkQ,Kishore Nekkalapudi,"You must visit this place for SURE. It's very well maintained and very beautiful from inside too, not just outside. Do visit the museums inside (it has an extra ticket for that), that are well detailed and maintained.
Walk all the way inside for the nice architecture... You can click a lot of good pics too. There is a market inside, but I felt the prices were higher than that of outside, so better not buy or bargain well. You'll at least need an hour to go through everything in there.",4 months ago, 5 stars 
ChIJ74XAbuL8DDkR-wJQ-vQyHkQ,AroodRao Desai,"Beautiful fort but badly maintained.
Would require more than 2 hours to explore this completely 
So plan accordingly 
No eateries available inside the complex so make sure you eat something before going in since it requires a lot of walking.
Souvenir shops available inside

Must visit if you’re in Delhi and don’t forget to visit the museum inside for additional fee",2 months ago, 4 stars 
ChIJ74XAbuL8DDkR-wJQ-vQyHkQ,Giri Kumar,"Lovely fort. When compared to other monuments maintenance, it is well maintained. Big fort. Good time to visit is from 3 pm to 7 pm. During the light you can roam around. After light, you can see beauty of the fort with lighting. Shopping is also good here",3 months ago, 5 stars 
ChIJ74XAbuL8DDkR-wJQ-vQyHkQ,Rudrajit Dey,"Great Monument of Mughal era....awesome gardens and parks...built within a massive area. Many museums with a wealth of historical information. Affordable entry fees. Drinking water and toilet facilities available inside. Lots of shady trees inside. Approach pathway is dotted with shops selling decorative items, replicas of structures of historical importance. A sure place to visit in Old Delhi.",3 months ago, 5 stars 
ChIJ74XAbuL8DDkR-wJQ-vQyHkQ,sachin stardom,"Historical Fort.
Great experience.
Clean and healthy environment.
Best place to visit and hangout.
You can do shopping as well.
Picture clicking also allow.
Don't touch anything while you are in museums.
Alot of museums to visit and know the history of India.
Thousands of people visit day by day.
Great beauty of architecture.
In Very large area.
Once you visit it memorable to you.
Recommend to visit once ♥️
Jai Hind 🙏",a week ago, 5 stars 
ChIJ74XAbuL8DDkR-wJQ-vQyHkQ,Kumar Prince,"Better to pay via an app, rather than at the pay-booths, which seem to be around a kilometre away from the real entrance !

Overseas tourists pay around ten times the entrance fee of Indian nationals ! Is that welcoming ?

Take plenty of drinking water with you, as there is much ground to cover, within the walls, with many separate buildings and pavilions to view ! Squirrels and well-fed stray dogs appear to co-habit, peacefully, too !

The traders, inside, close to the entrance/exit, are ruthless at exploiting the most casual of interest - especially when they see you are hot and tired, and about to leave !

You can easily spend 2 to 3 hours, here, and there are plenty of stone seats, (or low flat-topped walls ?) to rest tired limbs !

Take your cameras !",2 months ago, 5 stars 
ChIJ74XAbuL8DDkR-wJQ-vQyHkQ,Geethica Mehra,"This is the beauty of Delhi. Enjoy the light and sound show. There are 5 museums that are awesome. Don't forget to visit them. They close the museum at 5 PM. Local market gives you a feeling of that decade when queens used to shop there. Click photos when it's dark, Red Fort looks beautiful in lights.",4 months ago, 5 stars 
ChIJ74XAbuL8DDkR-wJQ-vQyHkQ,Akash Nath,"Really well maintained Mughal era monument. In addition to having irreplaceable historical value, the area and the fort currently also serves as the venue for many important government programs. 

Be sure to be enthralled by bits of history every direction you look. 

I would recommend taking an audio guide from the entrance. It's value for money and you can always repeat and go at your own pace. 

The museums have more of storytelling value than actual exhibits. But recommended nonetheless.",3 months ago, 5 stars 
ChIJ74XAbuL8DDkR-wJQ-vQyHkQ,Prachi Chaudhary,"I loved the place. Its huge , it has museums and market and a big compound. It's so very informative. I visited the museum of freedom fighters and artists and there are many other. Once cant complete it in one day.",2 months ago, 5 stars 
ChIJ74XAbuL8DDkR-wJQ-vQyHkQ,shweta singh,"Must visit if you are in Delhi, Capital of India.
It’s one of old but well maintained fort. Try to see it both in day bright sunlight as well as when dark sets in and entire fort light up.
Definite try is the Meena Bazaar... it takes you back to 1800 century world.
Do visit the museums, many new collections added in recent years.",3 months ago, 5 stars 
ChIJ74XAbuL8DDkR-wJQ-vQyHkQ,VISHANU KRISLOW,"INDIA. S PRIDE. THE HILARIOUS.. HISTORICAL. ""THE RED FORT""... 
NO WORDS ABOUT TO SAY. THIS... 
MILLIONS PEOPLE NOT ABOUTS TO SAY THIS PLACE BECAUSE THIS IS AWESOME... 
HIGHER IS HIGHER.. MONUMENTS IN DELHI. THERE ARE IN ONE OF THEM 

.",3 months ago, 5 stars 
ChIJ74XAbuL8DDkR-wJQ-vQyHkQ,manish kumar,"It's a beautiful place to reminisce your history. The coolness of the air at the top of the fort is incomparable. One should visit the place with your adored one to have the total fun. You have lush green lawns and so many spots to have a seat and talk.Each wall really has a story to tell. Hence ,one must really take a professional guide to be informed accordingly.To enter inside red fort you need to get the tickets and if you will pay offline it will cost u around 50 rupees for just visiting and around 80 rupees for museum. But online you need to pay only 35 rupees and 56 rupees for museum so you can book online it will be easy for you.........................................",5 months ago, 5 stars 
ChIJ74XAbuL8DDkR-wJQ-vQyHkQ,Wes McCall,I had a nice visit at the Red Fort in New Delhi today.  My local friend helped make this an easy & enjoyable visit.  Very friendly people at this historic site. The street market across the road was a taste of real India & its people. Check it out ...,3 months ago, 4 stars 
ChIJ74XAbuL8DDkR-wJQ-vQyHkQ,Aditya Dugar,Good monument to spend time at. Really appreciate the effort taken to digitise the ticketing process. Saves a lot of time. Has been well maintained although would've loved it more had the fountains been operational and the tanks lying around would be hidden from plain sight. A plus point for me were the information tablet (stones) placed next to each significant part of the monument.,3 months ago, 4 stars 
ChIJ74XAbuL8DDkR-wJQ-vQyHkQ,MOHD KASHIF KHAN,"Best Historical monument in old Delhi.
Attractions near Red Fort:

(1.46 km) Delhi metro

(0.90 km) Chandni chowk

Ticket at reasonable price for Indians only
Overseas visitors have different charge.
 
Redford have big green grass park with trees and A mosques , A museum and Ambience",2 months ago, 5 stars 
ChIJ74XAbuL8DDkR-wJQ-vQyHkQ,Sanjeev Nair,"Having seen all the 4 metros, Delhi is truly worthy of being called the capital of India. And what makes it special ? The Red Fort ! You must see it in the evening , with the lights on .. spell binding. Also felt nostalgic passing through Mina Bazaar.",2 months ago, 5 stars 
ChIJ74XAbuL8DDkR-wJQ-vQyHkQ,s H s sakar hote sapne,"There is a lot of cleanliness in the Red Fort. People come from far and wide to see the Red Fort. It is the pride of India. The Red Fort is a museum in the Red Fort of India. It is very important to see this museum, the revolution of 1857 and Subhash Chandra in the museum.  Bose's memorable scene is seen if you go to Delhi, it is very important to see the Red Fort.

👍👍👍👍👍",2 months ago, 5 stars 
ChIJ74XAbuL8DDkR-wJQ-vQyHkQ,Shubham Tashildar,Very beautiful place for tourist also and us.. There is various different types of architectural structure and best experience to get history..,3 weeks ago, 5 stars 
ChIJ74XAbuL8DDkR-wJQ-vQyHkQ,Ritik Dalal,Beautiful place to visit with family. Various museums highlight the Indian freedom struggle. Remains from Subhash Chandra Bose and Indian National army are also showcased. The market is very beautiful as well. If you are in Delhi you must visit.,2 months ago, 4 stars 
ChIJ74XAbuL8DDkR-wJQ-vQyHkQ,Sumit Mathur,"Long walks, not maintained, bazaar is nice if you need ladies items",2 days ago, 3 stars 
ChIJ74XAbuL8DDkR-wJQ-vQyHkQ,Riya karn,"Amazing place to visit, you will definitely having fun. Inside this place you will see the beauty of our history.",a week ago, 5 stars 
ChIJ74XAbuL8DDkR-wJQ-vQyHkQ,praveen sai,"One of the major place in delhi. Most popular sight seeings and must visit place in delhi. This fort have an important history and protected place. This places needs a ticket to visit and can be bought online too. Minimum 3 hours of time is needed to visit this place. Best time to visit is in winters as summers in delhi show up temperatures up-to 50 degree Celsius. Inside shopping is also there for handicrafts and kids toys. Best time pass for families, friends, children and history enthusiasts.",3 days ago, 4 stars 
ChIJ74XAbuL8DDkR-wJQ-vQyHkQ,Tejas Savla,Very beautiful place in the heart of Delhi. Must visit in if you are visiting Delhi. Every year our Prime Minister delivers speech from Red Fort. One of the biggest fort in India. Need 3 - 4 hours for this beautiful place. Better cloak room needed at this place. Open loot has been going at this place in cloak room. Have complained this to Archeological Survey of India.,3 months ago, 5 stars 
ChIJ74XAbuL8DDkR-wJQ-vQyHkQ,Ashik Antony,"This place is full of knowledge. The history of india is written all over. It take minimum 5 hours to see and cover whole area. Great salute to freedom fighters. The value of freedom and the struggle for getting it is written in each and every stone. Here every single view have a story. Love, Share, and Enjoy.",3 months ago, 5 stars 
ChIJ74XAbuL8DDkR-wJQ-vQyHkQ,Cvm Ptl,"An architectural marvel, a fortress and beyond. It is the perfect embodiment of changes that each generation of the mughal dynasty brought in terms of architecture and lifestyle. The chambers and stories attached to them are enticing. Each wall really has a story to tell. Hence ,one must really take a professional guide to be informed accordingly .The part that belonged to emperor Akbar is the one where one should invest time. Also one must have patience and energy to work. Although it was sad that the government locked a good amount of the fort and made it inaccessible to the general public.",4 months ago, 5 stars 
